transcript_hebrew,intent
זמני רכבת מקום,transport_query
איך מזג האוויר השבוע,weather_query
האם לדעתך ירד גשם היום,weather_query
מתי מגיעה הרכבת לתחנת קינגס קרוס,transport_query
מתי יוצאות שלוש הרכבות הבאות לבויסי,transport_query
צור רשימה חדשה עבורי,lists_createoradd
מה תחזית מזג האוויר,weather_query
מה יהיה מזג האוויר מחר במומבאי,weather_query
האם תוכל להוסיף את גלוריה לרשימת הלקוחות שלי,lists_createoradd
"אני צריך שתוסיף ""לצאת עם הכלב"" לרשימת המטלות שלי",lists_createoradd
מהי הטמפרטורה הנוכחית באוסטין,weather_query
הזהר אותי כשהטמפרטורה החיצונית מגיעה ל-68 מעלות,weather_query
הראה לי תחזית,weather_query
פתח לי רשימה חדשה,lists_createoradd
האם אני צריך ללבוש מעיל גשם היום,weather_query
האם מזג האוויר רע בניו יורק כרגע,weather_query
האם אצטרך ז'קט,weather_query
שקע דולק,iot_wemo_on
האם תוכל להזמין כרטיס לגרנד רפידס ברכבת,transport_query
האם יש מקום ברשימת המכולת שלי לפריט נוסף,lists_createoradd
מזג האוויר השבוע,weather_query
איך מזג האוויר בשיקגו,weather_query
מה הסיכוי לברד השבוע,weather_query
איך אני מגיע לאתונה ברכבת,transport_query
האם אני צריך למרוח קרם הגנה כשאני הולך למועדון גולף,weather_query
אנא ספר מה יהיה מזג האוויר בוושינגטון הבירה לשבוע הקרוב,weather_query
האם ירד גשם,weather_query
מתי מגיעה הרכבת מניו יורק,transport_query
תן לי פרטים על מזג האוויר ב-15 במרץ,weather_query
איך נראית התחזית לחמישה ימים בניו יורק,weather_query
האם אני צריך מעיל היום,weather_query
מתי הרכבת לסן פרנסיסקו אמורה להגיע,transport_query
מצא כרטיסים לרכבת לתחנת הרכבת מנצ'סטר להיום,transport_query
האם יורד שלג כרגע,weather_query
האם אני צריך להשתמש בקרם הגנה לפני שאני נפגש עם חבר שלי לארוחת צהריים,weather_query
האם יורד גשם היום,weather_query
כמה זמן לוקח להגיע לשם,transport_query
האם הטמפרטורה תהיה מעל נקודת הקיפאון ביום רביעי,weather_query
מתי הזמן הטוב ביותר לטייל לקנדה ואיזה שדה תעופה להשתמש,transport_query
תוכל לומר לי מה הטמפרטורה לשבת בלילה,weather_query
האם אני צריך ז'קט אחר הצהריים,weather_query
הצג לי מפה של המיקום הזה,transport_query
"מה מזג האוויר בקוד דואר 32,234",weather_query
איך מזג האוויר יהיה השבוע,weather_query
איך מזג האוויר כרגע,weather_query
האם אני צריך מעיל קל או כבד היום,weather_query
אני צריך להכין רשימת מטלות לעבודה,lists_createoradd
תקן את מסלול הנהיגה מכאן לגרנט שוק,transport_query
האם עלי לחבוש כובע היום,weather_query
מזג האוויר בעיר הולדתי,weather_query
תן את המסלול הקצר ביותר לשדה התעופה,transport_query
באיזו שעה יוצאות הרכבות לאטלנטה,transport_query
האם מזג האוויר נורמלי היום,weather_query
האם יש סיכוי לשלג ביום רביעי,weather_query
צור רשימה,lists_createoradd
תוכל לומר לי מה מזג האוויר באלבמה מחר,weather_query
שאל את החבר שלי איך מזג האוויר שם,weather_query
האם מזג האוויר רגוע היום,weather_query
מתי הרכבת האחרונה היום,transport_query
מה מזג האוויר במיניאפוליס,weather_query
שים נעליים ברשימה שלי,lists_createoradd
אני רוצה לדעת מה מזג האוויר בסן פרנסיסקו,weather_query
תן לי את דוח מזג האוויר לשבוע זה,weather_query
איך מזג האוויר הנוכחי בוושינגטון הבירה,weather_query
תן לי את מזג האוויר עבור מרסד בשעה שלוש אחר הצהריים,weather_query
הוסף שירים חדשים לרשימת ההשמעה שלי,lists_createoradd
אני צריך רשימה של שחקני הקריקט של נבחרת הודו ששיחקו בשנת 2014,lists_createoradd
מה תחזית מזג האוויר בבייג'ין,weather_query
איך מזג האוויר,weather_query
האם מזג האוויר יהיה חם או קר מחר,weather_query
האם ירד גשם במנילה מאוחר יותר,weather_query
האם מחר תהיה טמפרטורה חמה,weather_query
מה תחזית מזג האוויר להיום,weather_query
 מה מזג האוויר בעיר הולדתי,weather_query
האם ירד גשם בערב,weather_query
הצג לי את מזג האוויר בדאלאס,weather_query
האם אני צריך לקחת מטריה הערב,weather_query
מה הסיכוי לגשם היום,weather_query
מתי רכבת ניו יורק תגיע,transport_query
היום שמשי,weather_query
הפעל את מתג ה-וומו,iot_wemo_on
אני רוצה לדעת האם ניתן להוסיף פריט נוסף לרשימת הקניות שלי,lists_createoradd
הראה לי מזג אוויר של ימי הולדת,weather_query
האם זה יהיה סוער היום,weather_query
כמה זמן לוקח לרכבת להגיע לאורלנדו,transport_query
אנא תן לי כיוונים לפארק קרוב אליי,transport_query
כמה רחוקה נקודת העצירה הקרובה,transport_query
אנא הוסף פריט לרשימה,lists_createoradd
קבע כיוון לשוק המרכזי,transport_query
האם יירד גשם ביום שישי,weather_query
מצא לי את המרחק והכיוון ברכבת לבאיקוי לאגוס,transport_query
היי גוגל חם מדי בחוץ מה הטמפרטורה אחר הצהריים,weather_query
האם תוכל ליצור עבורי רשימה חדשה,lists_createoradd
מה מזג האוויר השבוע,weather_query
הפעל את שקע התקע באמבטיה שלי,iot_wemo_on
בחר את הפריט,lists_createoradd
לחץ על כל הכפתורים בלוח המחוונים,iot_wemo_on
הוסף פריט,lists_createoradd
בדיקה רפואית חדשה רשימה חדשה,lists_createoradd
האם יש רכבת בשעה חמש ביום רביעי לרוקוויל,transport_query
איך מזג האוויר בטורונטו,weather_query
מה מזג האוויר לידיי,weather_query
מהו זמן הנסיעה המשוער לרכבת לאורלנדו,transport_query
מתי הרכבת מסן דייגו תגיע לנורת'ווד,transport_query
מתי הרכבת האחרונה יוצאת מפריז,transport_query
תספר לי על מזג האוויר בניו יורק,weather_query
תאמר לי מה מזג האוויר הנוכחי בניו יורק,weather_query
האם אני צריך ז'קט בערב,weather_query
ספר לי על מזג האוויר הנוכחי,weather_query
האם יהיה מחר יום סוער,weather_query
אני צריך להוסיף תפוזים לרשימת המכולת שלי,lists_createoradd
אוקיי גוגל איך יהיה מזג האוויר בעשרים במרץ אלפיים ושבע עשרה,weather_query
האם תוכל ליצור רשימה חדשה עבורי,lists_createoradd
האם מחר יהיה חם,weather_query
מזג אוויר בדאקה,weather_query
מתי הרכבת שלי מגיעה,transport_query
האם אוכל לייבש את הבגדים שלי על הקו,weather_query
מה קורה בחוץ,weather_query
היי איך יהיה מזג האוויר היום בלוס אנג'לס קליפורניה,weather_query
האם יהיה שלג השבוע,weather_query
היום הוא יום שמש או לא,weather_query
מה זמני היציאה וההגעה של הרכבת הזו,transport_query
מתי יוצאת הרכבת הבאה שנוסעת לעיר הזו,transport_query
מה מזג האוויר לשבוע הלימודים,weather_query
פתח רשימה חדשה,lists_createoradd
שים פיצה ברשימה,lists_createoradd
איך מזג האוויר מחר,weather_query
מה הכרטיס הזול ביותר שזמין לשבוע הבא לטיול הלוך ושוב של שלושה ימים לאיסלנד,transport_query
תגיד לי אם כדאי לי להשתמש ברכבת או באוטובוס כדי להגיע לעיר היום,transport_query
התחל רשימה חדשה עבורי,lists_createoradd
תחזית מזג האוויר לשבוע הזה,weather_query
מזג האוויר באוגוסטה ג'ורג'יה,weather_query
האם ירד שלג,weather_query
הפעל את השקע החכם,iot_wemo_on
האם עלי לקחת מטריה היום,weather_query
צור רשימה עבור הדברים הבאים,lists_createoradd
האם מזג האוויר קר שם,weather_query
איך נראה מזג האוויר בלוס אנג'לס,weather_query
אלכסה ציין את מזג האוויר בעיר שלנו,weather_query
האם מזג האוויר מעונן הלילה,weather_query
אפשר להגדיר לוחות זמנים למכשירים שלך ולשלוט בהם מרחוק באמצעות חיבור לאינטרנט,iot_wemo_on
האם עליי ללבוש מעיל בחוץ,weather_query
הפעל את השקע החכם,iot_wemo_on
האם מזג האוויר השתנה ליום רביעי,weather_query
הוראות למקום,transport_query
אני רוצה שתיצור לי רשימה,lists_createoradd
האם יהיה קר מחר,weather_query
הוסף חמאה לרשימה,lists_createoradd
תן לי את מזג האוויר של חמשת הימים האחרונים,weather_query
אתה יכול להגיד לי את זמן הרכבת שנוסעת לקרישנאראפוראם מבנגלור,transport_query
האם יירד גשם בשבת,weather_query
האם מזג האוויר יהיה נחמד בשבת,weather_query
מסלול בבקשה,transport_query
מה השעה הנוחה ביותר לתפוס רכבת ליורק בשבת,transport_query
האם אני צריך לשים ז'קט כשאני יוצא החוצה,weather_query
איך מזג האוויר בחוץ זה מעונן,weather_query
מתי הרכבת יוצאת לשיקגו מאן ארבור,transport_query
מה הטמפרטורה בחוץ,weather_query
הפעל את השקע,iot_wemo_on
תודיע לי על מזג האוויר היום,weather_query
הפעל את הוומו,iot_wemo_on
האם יהיה קר מספיק לכפפות מאוחר יותר הלילה,weather_query
איזה רכבות זמינות,transport_query
מה מזג האוויר היום,weather_query
איך מזג האוויר,weather_query
מהו הזמן הארוך ביותר למקום מסוים,transport_query
האם עליי לנעול סנדלים,weather_query
מיקום זמני רכבת,transport_query
הפעל את שקע הוומו,iot_wemo_on
תן לי זמני רכבת למחר לשיקגו,transport_query
"הוסף ""החלפת שמן"" לרשימת המטלות שלי",lists_createoradd
מתי היום החם הבא,weather_query
דוח מזג אוויר חודשי,weather_query
הדרך הקרובה ביותר לחזור הביתה,transport_query
האם אני אצטרך קרם הגנה אחר הצהריים,weather_query
גוגל מתי אוכל לתפוס את הרכבת הקרובה ביותר אליי,transport_query
"דו""ח מזג האוויר של השבוע",weather_query
זמני רכבות לניו יורק,transport_query
מה מזג האוויר להיום,weather_query
האם כדאי לי להביא נעלי שלג,weather_query
איך מזג האוויר כרגע,weather_query
האם יורד שלג עכשיו,weather_query
איך יהיה מזג האוויר בשבת,weather_query
מה מזג האוויר היום,weather_query
מה מזג האוויר באוסטין,weather_query
האם קר בחוץ,weather_query
צור רשימה חדשה של גזעי כלבים,lists_createoradd
פתח תחזית מזג אוויר,weather_query
ספר לי את מזג האוויר עבור ברייטון פאה החדשה,weather_query
הראה לי היום את כל זמני הרכבות לשעתיים הקרובות בג'ודפור לפאלי,transport_query
אלכסה צרי רשימה חדשה,lists_createoradd
מה מזג האוויר בגרנד ראפידס מי עכשיו,weather_query
רשימה חדשה בבקשה,lists_createoradd
הראה לי את ההוראות לבית הקפה הקרוב ביותר,transport_query
מה היה הדיווח על מזג האוויר להיום,weather_query
האם יירד גשם בשבת,weather_query
האם תוכל לתת לי דיווח על מזג האוויר,weather_query
מצא זמני רכבות לניו יורק,transport_query
מה מזג האוויר בטורונטו היום,weather_query
מחיר כרטיס רכבת מדלהי למומבאי,transport_query
מתי הרכבת הבאה לרומא תגיע,transport_query
מזג האוויר בסן אנטוניו טקסס,weather_query
מחר יום שמש נכון,weather_query
הפעל את שקע החכם של וימו לחבר את הדונגל שלי,iot_wemo_on
איזה יום יהיה שמשי,weather_query
האם חם או קר בחוץ,weather_query
האם יש סיכוי לגשם במיסור כדי להפיג את החום,weather_query
האם תהיה שקיעה בשעה חמש וחצי מחר,weather_query
מה הייתה הטמפרטורה בניו יורק הבוקר,weather_query
באיזו שעה מגיעה הרכבת מסן דייגו לצפון הוליווד,transport_query
תכין רשימת מטלות,lists_createoradd
צור רשימת חופשה,lists_createoradd
אנא התחל רשימה חדשה,lists_createoradd
האם תוכל ליצור רשימה חדשה בפלייליסט,lists_createoradd
תגיד לי את הדיווח על מזג האוויר להיום בעיר אלבמה,weather_query
איך היום בחוץ,weather_query
"תוסיף ""לשטוף את האוטו"" לרשימת המטלות שלי",lists_createoradd
מתי הרכבת הבאה לעבודה יוצאת,transport_query
איך אוכל להגיע לרחוב העתיק,transport_query
תגידי לי את מחיר כרטיס הרכבת מקליפורניה לשיקגו,transport_query
בדוק את מזג האוויר של העיר שמתחילה באות הא',weather_query
מזג אוויר באטלנטה,weather_query
האם אני צריך למרוח קרם הגנה היום,weather_query
תפעיל את התנור,iot_wemo_on
הצג לי את זמני הרכבת של היום לקלקה בג'ודפור,transport_query
תפתחי לי רשימה חדשה,lists_createoradd
תני לי הוראות להגיע מכאן לקרסנט סיטי ברוהאוס בניו אורלינס,transport_query
האם אני יכול לצאת בלי מטרייה,weather_query
תציגי רכבות לאנטוורפן אחרי השעה שתיים אחר הצהריים בשבת,transport_query
מה התחזיות לטמפרטורות אחר הצהריים,weather_query
האם אני צריך את ציוד הגשם שלי,weather_query
הוסף פריט,lists_createoradd
גוגל מהי הטמפרטורה בחוץ,weather_query
מה המחיר להזמנת כרטיס רכבת,transport_query
האם אצטרך לקחת מטריה איתי היום,weather_query
תתחיל רשימת מכולת חדשה,lists_createoradd
האם כדאי לי לקחת מעיל לבירמינגהם הערב,weather_query
האם אני צריך לשים קרם הגנה היום,weather_query
מה הטמפרטורה בחוץ,weather_query
מה התחזית לשבוע הזה,weather_query
אנא התחל רשימה חדשה,lists_createoradd
תחזית מזג האוויר השבוע,weather_query
תנאי מזג האוויר למחר,weather_query
בדוק את זמן הרכבת 10887 מתחנת ג'ודפור ביום שני,transport_query
תוסיף את זה לרשימה שלי,lists_createoradd
אתה צריך לתת לי הוראות שונות,transport_query
מה תהיה הטמפרטורה היום,weather_query
האם עלי לקחת מטריה לעבודה היום,weather_query
אני צריך את זמן ההגעה של רכבת ניו יורק,transport_query
תמפה מסלול מכאן לאביטה ברו פאב,transport_query
אני מקווה שמזג האוויר שמשי שם,weather_query
מה תחזית מזג האוויר לשבוע הזה,weather_query
האם אני יכול לנעול סנדלים,weather_query
כמה חם עכשיו בקוסטה מסה,weather_query
מזג אוויר היום,weather_query
איך מזג האוויר בחוץ,weather_query
תיצור רשימה חדשה בשם מכולת בבקשה,lists_createoradd
מתי הרכבת שאנחנו נמצאים עליה תגיע לתחנה הבאה,transport_query
מה מזג האוויר היום בספרינגפילד,weather_query
מזג האוויר בשיקגו,weather_query
האם היום שמשי,weather_query
בבקשה תמצא כל השמות שמתחילים באות ג' ותיצור רשימה,lists_createoradd
תגיד לי איך להגיע מכאן לצ'יימס בקובינגטון,transport_query
איך יהיה מזג האוויר בשבת,weather_query
תוסיף גם את זה,lists_createoradd
האם יירד שלג הלילה,weather_query
תפתח את ההערות שלי,lists_createoradd
האם יורד שלג בקליפורניה,weather_query
תוכל לכוון אותי ממקדונלד'ס במנהטן עד הבית שלי,transport_query
תוכל להדליק את שקע ה-וומו,iot_wemo_on
באיזו שעה אגיע הביתה אם אקח את הרכבת הזו,transport_query
האם יהיה חם,weather_query
האם שמש בחוץ ברגע זה,weather_query
תגיד לי את הדרך המהירה ביותר לבית של ג'ו,transport_query
מה הייתה הטמפרטורה כשהייתי בפארק,weather_query
כמה מרחק יש לרכבת מכאן,transport_query
איפה המסעדה המקסיקנית הקרובה ביותר,transport_query
האם אצטרך מעיל חורף הבוקר,weather_query
מה מזג האוויר יהיה בעוד שבוע,weather_query
האם היום יום לקרם הגנה,weather_query
מה הטמפרטורה היום,weather_query
תכוון אותי למקדונלד'ס הקרוב ביותר,transport_query
האם יהיו גשמים מחר בבוקר,weather_query
מה זמני הרכבת לשיקגו,transport_query
מה מזג האוויר השבוע,weather_query
מה המסלול המהיר ביותר להגיע בסירה ליפן,transport_query
מה תחזית מזג האוויר לשיקגו,weather_query
נא ליצור רשימה חדשה,lists_createoradd
מה מזג האוויר במשך כל השבוע,weather_query
מזג האוויר בעיר הנופש,weather_query
האם יירד גשם בשבת,weather_query
יש להוסיף פריט זה לרשימה,lists_createoradd
מה התחזית למחר,weather_query
מה התדירות של יציאת רכבות בשיקגו,transport_query
האם אצטרך מטריה להיום,weather_query
האם אני אצטרך לשאת איתי מטרייה היום,weather_query
מה יהיה שיא הטמפרטורה להיום,weather_query
האם תוכל להגיד לי מה מזג האוויר ליום שני,weather_query
תוסיף את המסמכים האלה לדברים שאני צריך לנסוע איתם,lists_createoradd
מה מזג האוויר יהיה בתאריך,weather_query
האם אצטרך מעיל כבד אחרי ארוחת הצהריים היום,weather_query
תוסיף את השיר לפלייליסט החדש,lists_createoradd
איך יהיה מזג האוויר היום בערב,weather_query
מה דוח מזג האוויר,weather_query
אנא הפעל את שקע וומו,iot_wemo_on
תוסיף מרק לרשימת הקניות שלי,lists_createoradd
מהי התחזית הנוכחית למינאפוליס,weather_query
מתי הרכבת המקומית הבאה ממומביי לפונה,transport_query
תדליק את הוומו ,iot_wemo_on
מתי הרכבת הבאה לאורלנדו,transport_query
הוסף כרטיסייה לרשימת הקניות,lists_createoradd
האם אני אצטרך לשים קרם הגנה היום,weather_query
תכווני שעון מעורר לשעה 6:30 בבוקר.,alarm_set
תכווני שעון לעוד חצי שעה.,alarm_set
תוסיפי לי ביומן פגישה עם המנהל ביום שני ב-9 בבוקר.,calendar_set
תוסיפי לי ביומן אירוע למשחק כדורגל בשבת.,calendar_set
תכווני שעון לשעה שבע וחצי מחר בבוקר.,alarm_set
שימי שעון מעורר לשעה עשר בבוקר ביום ראשון.,alarm_set
אני צריך שעון מעורר לחמש וחצי בבוקר.,alarm_set
כווני שעון לשמונה בערב.,alarm_set
שימי לי שעון לעוד שעתיים מהזמן הנוכחי.,alarm_set
תוסיפי שעון מעורר לשעה שלוש אחר הצהריים.,alarm_set
תכווני לי שעון מעורר לשעה תשע מחר בבוקר.,alarm_set
תכווני שעון לשעה שבע בבוקר ביום חמישי.,alarm_set
שימי שעון מעורר לשעה ארבע אחר הצהריים.,alarm_set
כווני שעון לעוד חמש עשרה דקות.,alarm_set
שימי לי שעון לשעה עשר ורבע בבוקר מחר.,alarm_set
אני צריך שעון מעורר לעשר וחצי מחר בבוקר.,alarm_set
תכווני שעון לשעה שבע וחצי מחר בבוקר.,alarm_set
שימי שעון מעורר לשעה עשר בבוקר ביום ראשון.,alarm_set
אני צריך שעון מעורר לחמש וחצי בבוקר.,alarm_set
כווני שעון לשמונה בערב לפגישה.,alarm_set
שימי לי שעון לעוד שעתיים מהזמן הנוכחי.,alarm_set
תוסיפי שעון מעורר לשעה שלוש אחר הצהריים.,alarm_set
תכווני לי שעון מעורר לשעה תשע מחר בבוקר.,alarm_set
תכווני שעון לשעה שבע בבוקר ביום חמישי.,alarm_set
שימי שעון מעורר לשעה ארבע אחר הצהריים.,alarm_set
כווני שעון לעוד חמש עשרה דקות.,alarm_set
שימי לי שעון לשעה עשר ורבע בבוקר מחר.,alarm_set
אני צריך שעון מעורר לעשר וחצי מחר בבוקר.,alarm_set
תכווני שעון לשעה שבע וחצי מחר בבוקר.,alarm_set
שימי שעון מעורר לשעה עשר בבוקר ביום ראשון.,alarm_set
אני צריך שעון מעורר לחמש וחצי בבוקר.,alarm_set
כווני שעון לשמונה בערב לפגישה.,alarm_set
שימי לי שעון לעוד שעתיים מהזמן הנוכחי.,alarm_set
תוסיפי שעון מעורר לשעה שלוש אחר הצהריים.,alarm_set
תכווני לי שעון מעורר לשעה תשע מחר בבוקר.,alarm_set
תכווני שעון לשעה שבע בבוקר ביום חמישי.,alarm_set
שימי שעון מעורר לשעה ארבע אחר הצהריים.,alarm_set
כווני שעון לעוד חמש עשרה דקות.,alarm_set
שימי לי שעון לשעה עשר ורבע בבוקר מחר.,alarm_set
אני צריך שעון מעורר לעשר וחצי מחר בבוקר.,alarm_set
תכווני שעון לשעה שבע וחצי מחר בבוקר.,alarm_set
שימי שעון מעורר לשעה עשר בבוקר ביום ראשון.,alarm_set
אני צריך שעון מעורר לחמש וחצי בבוקר.,alarm_set
כווני שעון לשמונה בערב לפגישה.,alarm_set
שימי לי שעון לעוד שעתיים מהזמן הנוכחי.,alarm_set
תוסיפי שעון מעורר לשעה שלוש אחר הצהריים.,alarm_set
תכווני לי שעון מעורר לשעה תשע מחר בבוקר.,alarm_set
תכווני שעון לשעה שבע בבוקר ביום חמישי.,alarm_set
שימי שעון מעורר לשעה ארבע אחר הצהריים.,alarm_set
כווני שעון לעוד חמש עשרה דקות.,alarm_set
שימי לי שעון לשעה עשר ורבע בבוקר מחר.,alarm_set
אני צריך שעון מעורר לעשר וחצי מחר בבוקר.,alarm_set
תכווני שעון לשעה שבע וחצי מחר בבוקר.,alarm_set
שימי שעון מעורר לשעה עשר בבוקר ביום ראשון.,alarm_set
אני צריך שעון מעורר לחמש וחצי בבוקר.,alarm_set
כווני שעון לשמונה בערב לפגישה.,alarm_set
שימי לי שעון לעוד שעתיים מהזמן הנוכחי.,alarm_set
תוסיפי שעון מעורר לשעה שלוש אחר הצהריים.,alarm_set
תכווני לי שעון מעורר לשעה תשע מחר בבוקר.,alarm_set
